{
  "$schema": "http://json-schema.org/draft-07/schema#",
  "$id": "https://example.invalid/md-sf2/schemas/h3-spell-silence-gate-fixture.schema.json",
  "type": "object", "additionalProperties": false,
  "required": ["schemaVersion", "id", "romSha256", "emulator", "battleId", "observationBoundary", "sharedHarnessFixture", "function", "case", "expected"],
  "properties": {
    "schemaVersion": { "const": 1 }, "id": { "const": "sf2-silenced-caster-blocks-blaze1-v1" },
    "romSha256": { "type": "string", "pattern": "^[0-9A-F]{64}$" },
    "emulator": { "type": "object", "additionalProperties": false, "required": ["name", "version", "core"], "properties": { "name": { "const": "BizHawk" }, "version": { "const": "2.11.1" }, "core": { "const": "Genesis Plus GX" } } },
    "battleId": { "const": 1 }, "observationBoundary": { "type": "string", "minLength": 1 },
    "sharedHarnessFixture": { "const": "tests/fixtures/h3/spell-damage-resistance-v1.json" },
    "function": { "$ref": "#/definitions/function" }, "case": { "$ref": "#/definitions/case" }, "expected": { "$ref": "#/definitions/expected" }
  },
  "definitions": {
    "function": { "type": "object", "additionalProperties": false, "required": ["silenceFlagAppliedAddress", "silenceDecisionAddress", "silenceMessageAddress", "notSilencedAddress", "spellCostReactionAddress", "applyActionEffectAddress", "blazeEffectEntryAddress", "endExpSilenceDecisionAddress"], "properties": { "silenceFlagAppliedAddress": { "const": 41000 }, "silenceDecisionAddress": { "const": 40070 }, "silenceMessageAddress": { "const": 40076 }, "notSilencedAddress": { "const": 40106 }, "spellCostReactionAddress": { "const": 41510 }, "applyActionEffectAddress": { "const": 40144 }, "blazeEffectEntryAddress": { "const": 47836 }, "endExpSilenceDecisionAddress": { "const": 41840 } } },
    "case": { "type": "object", "additionalProperties": false, "required": ["id", "actor", "actorClass", "actorInitialMp", "actorInitialExp", "actorInitialStatus", "silenceMask", "actionType", "actionSpell", "baseSpell", "spellMpCost", "target", "targetInitialHp", "targetInitialMp", "targetInitialStatus"], "properties": { "id": { "const": "silenced-bowie-blaze1-blocked" }, "actor": { "const": 0 }, "actorClass": { "const": 0 }, "actorInitialMp": { "const": 20 }, "actorInitialExp": { "const": 0 }, "actorInitialStatus": { "const": 768 }, "silenceMask": { "const": 768 }, "actionType": { "const": 1 }, "actionSpell": { "const": 11 }, "baseSpell": { "const": 11 }, "spellMpCost": { "const": 2 }, "target": { "const": 128 }, "targetInitialHp": { "const": 100 }, "targetInitialMp": { "const": 2 }, "targetInitialStatus": { "const": 0 } } },
    "construction": { "type": "object", "additionalProperties": false, "required": ["silencedFlagAfterProperties", "silencedFlagAtDecision", "silencedMessageCommands", "notSilencedEntries", "costMpChange", "costStatusCommand", "applyActionEffectCalls", "blazeEffectCalls", "expSilencedFlag", "accumulatedExp", "actorMp", "actorStatus", "targetHp", "targetMp", "targetStatus"], "properties": { "silencedFlagAfterProperties": { "const": 255 }, "silencedFlagAtDecision": { "const": 255 }, "silencedMessageCommands": { "const": 1 }, "notSilencedEntries": { "const": 0 }, "costMpChange": { "const": -2 }, "costStatusCommand": { "const": 768 }, "applyActionEffectCalls": { "const": 0 }, "blazeEffectCalls": { "const": 0 }, "expSilencedFlag": { "const": 255 }, "accumulatedExp": { "const": 0 }, "actorMp": { "const": 20 }, "actorStatus": { "const": 768 }, "targetHp": { "const": 100 }, "targetMp": { "const": 2 }, "targetStatus": { "const": 0 } } },
    "allyReaction": { "type": "object", "additionalProperties": false, "required": ["combatant", "mpChange", "statusCommand", "mpBefore", "mpAfter"], "properties": { "combatant": { "const": 0 }, "mpChange": { "const": -2 }, "statusCommand": { "const": 768 }, "mpBefore": { "const": 20 }, "mpAfter": { "const": 18 } } },
    "replay": { "type": "object", "additionalProperties": false, "required": ["allyReactionCalls", "allyReaction", "enemyReactionCalls", "expReactionCalls", "finalActorMp", "finalActorExp", "finalActorStatus", "finalTargetHp", "finalTargetMp", "finalTargetStatus"], "properties": { "allyReactionCalls": { "const": 1 }, "allyReaction": { "$ref": "#/definitions/allyReaction" }, "enemyReactionCalls": { "const": 0 }, "expReactionCalls": { "const": 0 }, "finalActorMp": { "const": 18 }, "finalActorExp": { "const": 0 }, "finalActorStatus": { "const": 768 }, "finalTargetHp": { "const": 100 }, "finalTargetMp": { "const": 2 }, "finalTargetStatus": { "const": 0 } } },
    "expected": { "type": "object", "additionalProperties": false, "required": ["construction", "replay"], "properties": { "construction": { "$ref": "#/definitions/construction" }, "replay": { "$ref": "#/definitions/replay" } } }
  }
}
